{
  "schema_version": 1,
  "product": "LATAM",
  "date": "2026-10-01",
  "kind": "partial",
  "topic": "policy",
  "published_at": "2026-10-01T12:06:51.281Z",
  "web_url": "https://aldraresearch.com/sitreps/latam-2026-10-01",
  "headline": {
    "en": "Banco de la República raises rate to 12.25%",
    "es": "Banco de la República sube la tasa a 12,25%"
  },
  "summary": {
    "en": "Also: Brazil requests blocking of 5,209 betting sites; Supreme Court lifts limits on foreign land purchases; Ambito: BCRA records year’s lowest monthly dollar purchases.",
    "es": "También: Brasil pide bloquear 5.209 sitios de apuestas; La Corte libera la venta de tierras a extranjeros; Ambito: BCRA registra la menor compra mensual del año."
  },
  "stories": [
    {
      "id": "latam-2026-10-01-23e6317227",
      "status": "CONFIRMED",
      "heading": {
        "en": "Banco de la República raises rate to 12.25%",
        "es": "Banco de la República sube la tasa a 12,25%"
      },
      "text": {
        "en": "The Junta Directiva of Banco de la República raised the rate by 25 basis points to 12.25% by majority vote. Four directors backed the increase, two voted to hold and one sought a 50-basis-point rise. Annual inflation in August was 6.2%; core inflation reached 6.1%, its highest in the past year.",
        "es": "La Junta Directiva del Banco de la República subió por mayoría la tasa 25 puntos básicos, a 12,25%. Cuatro directores apoyaron el aumento, dos votaron por mantenerla y uno por subirla 50 puntos básicos. La inflación anual de agosto fue 6,2%; la básica alcanzó 6,1%, su máximo del último año."
      },
      "analysis": {
        "en": "Core inflation at its highest in the past year limits room to move toward less restrictive monetary policy.",
        "es": "La inflación básica en su máximo del último año reduce el margen para pasar a una política menos restrictiva."
      },
      "sources": [
        "https://banrep.gov.co/es/noticias/junta-directiva/junta-directiva-septiembre-2026",
        "https://x.com/BancoRepublica/status/2105381144212443213",
        "https://x.com/BancoRepublica/status/2105370159049298171",
        "https://x.com/petrogustavo/status/2105394996941918231"
      ]
    },
    {
      "id": "latam-2026-10-01-8581433e8a",
      "status": "CONFIRMED",
      "heading": {
        "en": "Brazil requests blocking of 5,209 betting sites",
        "es": "Brasil pide bloquear 5.209 sitios de apuestas"
      },
      "text": {
        "en": "Brazil requested blocks on 5,209 betting sites and more than 2,000 profiles after Lula’s September 25 ban. According to Estadao, Congress has up to four months to endorse it, while football clubs challenge it before the STF. The outlet gives bettors until 23h59 on October 5 to withdraw balances.",
        "es": "Brasil pidió bloquear 5.209 sitios de apuestas y más de 2.000 perfiles tras la prohibición de Lula del 25 de septiembre. Según Estadao, el Congreso tiene hasta cuatro meses para avalarla y clubes de fútbol la disputan ante el STF. El medio fija el retiro de saldos hasta las 23h59 del 5 de octubre."
      },
      "analysis": {
        "en": "Congressional approval and the court challenge could shape the ban’s duration and scope.",
        "es": "El aval del Congreso y el frente judicial pueden definir la duración y el alcance de la prohibición."
      },
      "sources": [
        "https://infobae.com/america/america-latina/2026/09/30/continua-la-ofensiva-de-lula-contra-las-apuestas-el-gobierno-brasileno-pidio-el-bloqueo-de-5200-paginas-ilegales",
        "https://estadao.com.br/politica/coluna-do-estadao/conselho-de-direitos-humanos-pede-que-congresso-aprove-proibicao-das-bets"
      ]
    },
    {
      "id": "latam-2026-10-01-ecc8a0f66f",
      "status": "CONFIRMED",
      "heading": {
        "en": "Supreme Court lifts limits on foreign land purchases",
        "es": "La Corte libera la venta de tierras a extranjeros"
      },
      "text": {
        "en": "The Supreme Court overturned the ruling blocking Milei’s 2023 DNU, which repealed the land law. According to Clarin, article 154 of DNU 70/2023 remains in force, and Axel Kicillof called the ruling an “extremely serious decision.” Ambito reports that opposition lawmakers want Diputados to discuss the decree again.",
        "es": "La Corte dejó sin efecto el fallo que frenaba el DNU de 2023 de Milei, que derogó la ley de Tierras. Según Clarin, quedó vigente el artículo 154 del DNU 70/2023 y Axel Kicillof calificó el fallo de «decisión gravísima». Ambito reporta que legisladores opositores piden que Diputados vuelva a discutir el decreto."
      },
      "analysis": {
        "en": "A review of the decree in Diputados would offer a political route to challenge the opening enabled by the ruling.",
        "es": "Una revisión del decreto en Diputados sería una vía política para disputar la apertura que habilitó el fallo."
      },
      "sources": [
        "https://lanacion.com.ar/politica/la-corte-suprema-dejo-en-vigencia-la-derogacion-de-la-ley-de-tierras-que-decreto-milei-en-2023-nid29092026",
        "https://clarin.com/politica/axel-kicillof-califico-decision-gravisima-fallo-corte-elimino-restricciones-compra-tierras-parte-extranjeros_0_upp411qduf.html",
        "https://ambito.com/politica/fuerte-rechazo-opositor-al-fallo-la-corte-suprema-la-ley-tierras-n6328328"
      ]
    },
    {
      "id": "latam-2026-10-01-caf3cb432d",
      "status": "CLAIM",
      "heading": {
        "en": "Ambito: BCRA records year’s lowest monthly dollar purchases",
        "es": "Ambito: BCRA registra la menor compra mensual del año"
      },
      "text": {
        "en": "According to Ambito, BCRA bought USD 160 million and accumulated USD 473 million in September, the year’s lowest monthly total. Gross reserves fell USD 1,392 million in the session to USD 46,090 million, the outlet reported.",
        "es": "Según Ambito, el BCRA compró USD 160 millones y acumuló USD 473 millones en septiembre, el menor saldo mensual del año. Las reservas brutas cayeron USD 1.392 millones en la rueda y cerraron en USD 46.090 millones, reportó el medio."
      },
      "analysis": {
        "en": "Net dollar purchases alone do not measure reserve accumulation: assessing the position also requires tracking the gross reserve stock.",
        "es": "El saldo comprador no mide por sí solo la acumulación de reservas: evaluar la posición requiere mirar también el stock bruto."
      },
      "sources": [
        "https://ambito.com/finanzas/el-bcra-compro-us160-millones-un-maximo-julio-pero-registro-el-peor-saldo-mensual-del-ano-n6328623"
      ]
    }
  ],
  "content_hash": "ebf0369b690ecfcca89a0dabf4df67a7410ec843275d3a66c93cac2f9e73c2a3",
  "license": "CC-BY-4.0"
}
