{
  "schema_version": 1,
  "product": "LATAM",
  "date": "2026-10-02",
  "kind": "quiet",
  "topic": "geopolitics",
  "published_at": "2026-10-02T06:40:25.752Z",
  "web_url": "https://aldraresearch.com/sitreps/latam-2026-10-02",
  "headline": {
    "en": "No verified material changes today",
    "es": "Sin cambios materiales verificados hoy"
  },
  "summary": {
    "en": "Today's Signal Check found no developments with enough evidence to publish.",
    "es": "El Signal Check de hoy no encontró novedades con evidencia suficiente para publicarlas."
  },
  "stories": [],
  "content_hash": "8e1eb66c575290e3262f08b0310089ba153604796ff4385df347426414e2521f",
  "license": "CC-BY-4.0"
}
