{
  "schema_version": 1,
  "product": "GLOBAL",
  "date": "2026-10-01",
  "kind": "partial",
  "topic": "geopolitics",
  "published_at": "2026-10-01T11:44:49.651Z",
  "web_url": "https://aldraresearch.com/sitreps/global-2026-10-01",
  "headline": {
    "en": "Financial Times: 10-year yields jump half-point",
    "es": "Financial Times: rendimiento decenal sube medio punto"
  },
  "summary": {
    "en": "Also: CENTCOM announces end of Iraq anti-ISIS mission; The Cipher Brief: Houthis take Mocha and Perim.",
    "es": "También: CENTCOM anuncia fin de misión anti-ISIS en Irak; The Cipher Brief: hutíes toman Mocha y Perim."
  },
  "stories": [
    {
      "id": "global-2026-10-01-cb0004ac44",
      "status": "CLAIM",
      "heading": {
        "en": "Financial Times: 10-year yields jump half-point",
        "es": "Financial Times: rendimiento decenal sube medio punto"
      },
      "text": {
        "en": "10-year Treasury yields rose half a percentage point in their worst month in four years, according to Financial Times. Bloomberg reported a fresh 24-year high for long-bond yields, with resilient US spending bolstering expectations that the economy can handle higher interest rates.",
        "es": "El rendimiento de los Treasuries a 10 años subió medio punto porcentual en su peor mes en cuatro años, según Financial Times. Bloomberg reportó que los rendimientos de largo plazo renovaron un máximo de 24 años; el gasto resistente reforzó la expectativa de que Estados Unidos puede soportar tasas más altas."
      },
      "analysis": {
        "en": "Higher yields make new government borrowing more expensive. Watch whether spending continues to support expectations that the economy can handle higher rates.",
        "es": "El alza de rendimientos encarece la nueva financiación del gobierno. El próximo punto a vigilar es si el gasto sigue respaldando la expectativa de tolerar tasas altas."
      },
      "sources": [
        "https://ft.com/content/39de7709-7b5b-42f6-ad90-df50f1308ea2?syn-25a6b1a6=1",
        "https://bloomberg.com/news/articles/2026-09-30/traders-pull-back-on-october-fed-hike-bets-after-cool-pce-data"
      ]
    },
    {
      "id": "global-2026-10-01-d963bb122d",
      "status": "CONFIRMED",
      "heading": {
        "en": "CENTCOM announces end of Iraq anti-ISIS mission",
        "es": "CENTCOM anuncia fin de misión anti-ISIS en Irak"
      },
      "text": {
        "en": "Sean Parnell and Brad Cooper announced the end of Operation Inherent Resolve in Iraq after forces and equipment left Erbil Air Base. According to the announcement, the 12-year mission ends and Iraqi forces take responsibility for remaining ISIS threats. Infobae said the withdrawal was agreed two years ago.",
        "es": "Sean Parnell y Brad Cooper anunciaron el fin de Operation Inherent Resolve en Irak tras la salida de fuerzas y equipos de Erbil Air Base. Según el anuncio, termina una misión de 12 años y las fuerzas iraquíes asumen las amenazas restantes de ISIS. Infobae dice que la retirada se pactó hace dos años."
      },
      "analysis": {
        "en": "The next test is whether Iraqi forces can manage ISIS threats without the coalition mission; the transition changes who is responsible for handling them.",
        "es": "El siguiente punto de prueba es si las fuerzas iraquíes pueden gestionar las amenazas de ISIS sin la misión de coalición; la transición cambia quién responde por ellas."
      },
      "sources": [
        "https://x.com/sentdefender/status/2105292412935450841",
        "https://infobae.com/america/mundo/2026/09/30/el-ejercito-de-estados-unidos-afirmo-que-completo-la-retirada-de-sus-tropas-de-irak"
      ]
    },
    {
      "id": "global-2026-10-01-1fafcbb051",
      "status": "CLAIM",
      "heading": {
        "en": "The Cipher Brief: Houthis take Mocha and Perim",
        "es": "The Cipher Brief: hutíes toman Mocha y Perim"
      },
      "text": {
        "en": "The Cipher Brief says Houthis took the port of Mocha (Al-Makha), occupied Perim Island in Bab al-Mandab and seized stretches of the Red Sea coast. The article cites reports of Iranian Revolutionary Guard advisers guiding Houthi tactics. It says those positions threaten a key commercial waterway.",
        "es": "The Cipher Brief afirma que los hutíes tomaron el puerto de Mocha (Al-Makha), ocuparon la isla Perim en Bab al-Mandab y capturaron tramos de la costa del mar Rojo. El artículo cita reportes de asesores de la Guardia Revolucionaria iraní guiando las tácticas hutíes. El medio sostiene que esas posiciones amenazan una vía comercial clave."
      },
      "analysis": {
        "en": "Verifying who controls Perim is key to distinguishing a threat to commercial transit from an actual change in territorial control.",
        "es": "Verificar quién controla Perim es clave para distinguir una amenaza al tránsito comercial de un cambio efectivo del control territorial."
      },
      "sources": [
        "https://thecipherbrief.com/the-houthis-took-the-red-sea-coast-how-did-washington-miss-it"
      ]
    }
  ],
  "content_hash": "1a9c222503cbb4b51471e1efcc284a601e41928e7268465a7817450b5fa55039",
  "license": "CC-BY-4.0"
}
